{"schemaVersion":"1.0","id":"config-default","version":"v1","kind":"contract-api","risk":"medium","languages":["csharp"],"difficulty":"medium","inclusionReason":"Provides a safe local configuration default while preserving explicit settings.","prompt":"Add a typed ASP.NET Core configuration default for the local environment without hard-coding secrets or changing explicit environment variables.","initialState":{"repository":"backend/EuroCarScan.Api/appsettings.json","revision":"d8aaa37"},"setup":[],"scope":{"allow":["backend/EuroCarScan.Api/appsettings.json","backend/EuroCarScan.Api/Program.cs","backend/EuroCarScan.Api.Tests/FoundationTests.cs"],"deny":[".env","secrets"]},"verification":[{"command":["dotnet","test","backend/EuroCarScan.Api.Tests/EuroCarScan.Api.Tests.csproj","--nologo"],"timeoutSeconds":120}],"oracle":{"access":"evaluator-only","oracleRef":"oracles/config-default.json"},"limits":{"timeoutSeconds":120,"maximumOutputBytes":65536},"expectedOutcome":"PASS","dataClassification":"private-redacted"}
