{"schemaVersion":"1.0","id":"health-environment-field","version":"v1","kind":"contract-api","risk":"low","languages":["csharp"],"difficulty":"easy","inclusionReason":"Makes the local-only deployment environment explicit in health output.","prompt":"Extend the ASP.NET Core GET /health response with a deterministic environment field set to local, preserving existing fields and making no network calls.","initialState":{"repository":"backend/EuroCarScan.Api/Program.cs","revision":"d8aaa37"},"setup":[],"scope":{"allow":["backend/EuroCarScan.Api/Program.cs","backend/EuroCarScan.Api.Tests/FoundationTests.cs"],"deny":[".env","secrets"]},"verification":[{"command":["dotnet","test","backend/EuroCarScan.Api.Tests/EuroCarScan.Api.Tests.csproj","--nologo"],"timeoutSeconds":120}],"oracle":{"access":"evaluator-only","oracleRef":"oracles/health-environment-field.json"},"limits":{"timeoutSeconds":120,"maximumOutputBytes":65536},"expectedOutcome":"PASS","dataClassification":"private-redacted"}
