{"schemaVersion":"1.0","id":"rename-local","version":"v1","kind":"mechanical-local","risk":"low","languages":["typescript"],"difficulty":"easy","inclusionReason":"Local mechanical rename checks bounded edits.","prompt":"Rename the deprecated local helper and update its callers.","initialState":{"repository":"fixtures/rename-local","revision":"0000000"},"setup":[],"scope":{"allow":["src"],"deny":["secrets"]},"verification":[{"command":["npm","test"],"timeoutSeconds":30}],"oracle":{"access":"evaluator-only","oracleRef":"evaluator-oracles/rename-local.json"},"limits":{"timeoutSeconds":120,"maximumOutputBytes":65536},"expectedOutcome":"PASS","dataClassification":"public"}
