{"schemaVersion":"1.0","id":"health-service-field","version":"v1","kind":"contract-api","risk":"low","languages":["python"],"difficulty":"easy","inclusionReason":"Adds an explicit service identity to the local health contract.","prompt":"Extend the GET /health response with a deterministic `service` field set to `eurocarscan`, preserving the existing status, product, and version fields.","initialState":{"repository":"src/eurocarscan/web/routes.py","revision":"7c84e5a"},"setup":[],"scope":{"allow":["src/eurocarscan/web/routes.py"],"deny":[".env","secrets"]},"verification":[{"command":["python","-m","unittest","discover","-s","tests"],"timeoutSeconds":30}],"oracle":{"access":"evaluator-only","oracleRef":"oracles/health-service-field.json"},"limits":{"timeoutSeconds":120,"maximumOutputBytes":65536},"expectedOutcome":"PASS","dataClassification":"private-redacted"}
