{"schemaVersion":"1.0","id":"project-documentation","version":"v1","kind":"documentation","risk":"low","languages":["markdown"],"difficulty":"easy","inclusionReason":"Prevents future contributors from reintroducing an unapproved backend stack.","prompt":"Document the approved C# backend, Python-only ML boundary, and React/Next.js/TypeScript frontend in the project README, including the rule that Python is not the request-serving backend.","initialState":{"repository":"README.md","revision":"d8aaa37"},"setup":[],"scope":{"allow":["README.md","docs/ARCHITECTURE-DECISION.md"],"deny":[".env","secrets"]},"verification":[{"command":["dotnet","test","backend/EuroCarScan.Api.Tests/EuroCarScan.Api.Tests.csproj","--nologo"],"timeoutSeconds":120}],"oracle":{"access":"evaluator-only","oracleRef":"oracles/project-documentation.json"},"limits":{"timeoutSeconds":120,"maximumOutputBytes":65536},"expectedOutcome":"PASS","dataClassification":"private-redacted"}
