{"schemaVersion":"1.0","id":"api-contract","version":"v1","kind":"contract-api","risk":"high","languages":["typescript"],"difficulty":"hard","inclusionReason":"Public API contract migration.","prompt":"Make the API return a structured validation error while preserving valid responses.","initialState":{"repository":"fixtures/api-contract","revision":"0000000"},"setup":[],"scope":{"allow":["src","test"],"deny":["secrets"]},"verification":[{"command":["npm","test"],"timeoutSeconds":30}],"oracle":{"access":"evaluator-only","oracleRef":"evaluator-oracles/api-contract.json"},"limits":{"timeoutSeconds":180,"maximumOutputBytes":65536},"expectedOutcome":"PASS","dataClassification":"public"}
