{"schemaVersion":"1.0","id":"money-zero","version":"v1","kind":"contract-api","risk":"low","languages":["csharp"],"difficulty":"easy","inclusionReason":"Adds a clear zero-value predicate for settlement logic.","prompt":"Add an IsZero property to the immutable Money value object that returns true only when cents equals zero.","initialState":{"repository":"backend/EuroCarScan.Api/Domain/Money.cs","revision":"37f9210"},"setup":[],"scope":{"allow":["backend/EuroCarScan.Api/Domain/Money.cs","backend/EuroCarScan.Api.Tests/FoundationTests.cs"],"deny":[".env","secrets"]},"verification":[{"command":["dotnet","test","backend/EuroCarScan.Api.Tests/EuroCarScan.Api.Tests.csproj","--nologo"],"timeoutSeconds":120}],"oracle":{"access":"evaluator-only","oracleRef":"oracles/money-zero.json"},"limits":{"timeoutSeconds":120,"maximumOutputBytes":65536},"expectedOutcome":"PASS","dataClassification":"private-redacted"}
