{"schemaVersion":"1.0","id":"migration-index","version":"v1","kind":"mechanical-local","risk":"low","languages":["sql"],"difficulty":"easy","inclusionReason":"Adds a bounded read-performance index to the initial auction schema.","prompt":"Add an index named `idx_lots_status` on `lots(status)` to the initial migration. Keep the schema local-only and do not add users, organizations, purchases, or bidding tables.","initialState":{"repository":"migrations/001_initial.sql","revision":"7c84e5a"},"setup":[],"scope":{"allow":["migrations/001_initial.sql"],"deny":[".env","secrets"]},"verification":[{"command":["python","-m","unittest","discover","-s","tests"],"timeoutSeconds":30}],"oracle":{"access":"evaluator-only","oracleRef":"oracles/migration-index.json"},"limits":{"timeoutSeconds":120,"maximumOutputBytes":65536},"expectedOutcome":"PASS","dataClassification":"private-redacted"}
