{"schemaVersion":"1.0","id":"config-database-default","version":"v1","kind":"cross-file","risk":"medium","languages":["python"],"difficulty":"medium","inclusionReason":"Provides a safe local default while preserving explicit database configuration.","prompt":"When DATABASE_URL is unset or blank, make AppConfig use `sqlite:///eurocarscan.db` as the local default. An explicit non-empty DATABASE_URL must still win.","initialState":{"repository":"src/eurocarscan/config.py","revision":"7c84e5a"},"setup":[],"scope":{"allow":["src/eurocarscan/config.py","tests"],"deny":[".env","secrets"]},"verification":[{"command":["python","-m","unittest","discover","-s","tests"],"timeoutSeconds":30}],"oracle":{"access":"evaluator-only","oracleRef":"oracles/config-database-default.json"},"limits":{"timeoutSeconds":120,"maximumOutputBytes":65536},"expectedOutcome":"PASS","dataClassification":"private-redacted"}
