{"schemaVersion":"1.0","id":"preserve-refactor","version":"v1","kind":"refactor","risk":"medium","languages":["javascript"],"difficulty":"medium","inclusionReason":"A behavior-preserving refactor tests whether callers and edge cases survive cleanup.","prompt":"Refactor `tasks/preserve-refactor/src/total.js` to remove the duplicated addition branch while preserving totals for empty, positive, and negative arrays.","initialState":{"repository":"repos/preserve-refactor","revision":"0000000"},"setup":[],"scope":{"allow":["tasks/preserve-refactor/src"],"deny":["secrets"]},"verification":[{"command":["node","tasks/preserve-refactor/verify.mjs"],"timeoutSeconds":30}],"oracle":{"access":"evaluator-only","oracleRef":"oracles/preserve-refactor.json"},"limits":{"timeoutSeconds":120,"maximumOutputBytes":65536},"expectedOutcome":"PASS","dataClassification":"public"}
