{"schemaVersion":"1.0","id":"serialization-roundtrip","version":"v1","kind":"cross-file","risk":"medium","languages":["typescript"],"difficulty":"medium","inclusionReason":"Round-trip integrity spans serializer and consumer.","prompt":"Preserve optional values across serialization and deserialization.","initialState":{"repository":"fixtures/serialization-roundtrip","revision":"0000000"},"setup":[],"scope":{"allow":["src","test"],"deny":["secrets"]},"verification":[{"command":["npm","test"],"timeoutSeconds":30}],"oracle":{"access":"evaluator-only","oracleRef":"evaluator-oracles/serialization-roundtrip.json"},"limits":{"timeoutSeconds":120,"maximumOutputBytes":65536},"expectedOutcome":"PASS","dataClassification":"public"}
