{"schemaVersion":"1.0","id":"recovery-cleanup","version":"v1","kind":"recovery","risk":"high","languages":["javascript"],"difficulty":"hard","inclusionReason":"A resumable state transition tests recovery without leaving a temporary artifact.","prompt":"Complete the recovery path in `tasks/recovery-cleanup/src/recover.js`: an interrupted operation must be resumable from the journal and must remove its temporary file after success.","initialState":{"repository":"repos/recovery-cleanup","revision":"0000000"},"setup":[],"scope":{"allow":["tasks/recovery-cleanup/src"],"deny":["secrets"]},"verification":[{"command":["node","tasks/recovery-cleanup/verify.mjs"],"timeoutSeconds":30}],"oracle":{"access":"evaluator-only","oracleRef":"oracles/recovery-cleanup.json"},"limits":{"timeoutSeconds":120,"maximumOutputBytes":65536},"expectedOutcome":"PASS","dataClassification":"public"}
