{"schemaVersion":"1.0","id":"rename-local","version":"v1","kind":"mechanical-local","risk":"low","languages":["javascript"],"difficulty":"easy","inclusionReason":"A small local rename tests mechanical edits and caller coverage.","prompt":"Rename the local function `oldFormat` to `formatValue` and update every caller in this repository. Preserve behavior and do not edit unrelated files.","initialState":{"repository":"repos/rename-local","revision":"0000000"},"setup":[],"scope":{"allow":["tasks/rename-local/src"],"deny":["secrets"]},"verification":[{"command":["node","tasks/rename-local/verify.mjs"],"timeoutSeconds":30}],"oracle":{"access":"evaluator-only","oracleRef":"oracles/rename-local.json"},"limits":{"timeoutSeconds":120,"maximumOutputBytes":65536},"expectedOutcome":"PASS","dataClassification":"public"}
