{"schemaVersion":"1.0","id":"frontend-dashboard","version":"v1","kind":"contract-api","risk":"low","languages":["typescript","tsx"],"difficulty":"medium","inclusionReason":"Keeps the operator landing page explicit while the API grows.","prompt":"Add a read-only EuroCarScan dashboard heading and a health endpoint link to the Next.js landing page without adding a client-side secret or network credential.","initialState":{"repository":"frontend/app/page.tsx","revision":"d8aaa37"},"setup":[],"scope":{"allow":["frontend/app/page.tsx","frontend/app/layout.tsx"],"deny":[".env","secrets"]},"verification":[{"command":["npm","--prefix","frontend","run","typecheck"],"timeoutSeconds":120}],"oracle":{"access":"evaluator-only","oracleRef":"oracles/frontend-dashboard.json"},"limits":{"timeoutSeconds":120,"maximumOutputBytes":65536},"expectedOutcome":"PASS","dataClassification":"private-redacted"}
