{"schemaVersion":"1.0","id":"dashboard-count","version":"v1","kind":"cross-file","risk":"low","languages":["python","html"],"difficulty":"medium","inclusionReason":"Exposes the first read-only auction count in the operator dashboard fixture.","prompt":"Add a deterministic `auction_count` value of 0 to the dashboard fixture and render it in the dashboard template as a labeled read-only metric.","initialState":{"repository":"src/eurocarscan/web/routes.py","revision":"7c84e5a"},"setup":[],"scope":{"allow":["src/eurocarscan/web/routes.py","templates/dashboard.html"],"deny":[".env","secrets"]},"verification":[{"command":["python","-m","unittest","discover","-s","tests"],"timeoutSeconds":30}],"oracle":{"access":"evaluator-only","oracleRef":"oracles/dashboard-count.json"},"limits":{"timeoutSeconds":120,"maximumOutputBytes":65536},"expectedOutcome":"PASS","dataClassification":"private-redacted"}
