{"schemaVersion":"1.0","id":"preserve-refactor","version":"v1","kind":"refactor","risk":"medium","languages":["typescript"],"difficulty":"medium","inclusionReason":"Behaviour-preserving extraction.","prompt":"Extract duplicated parsing logic without changing observable behavior.","initialState":{"repository":"fixtures/preserve-refactor","revision":"0000000"},"setup":[],"scope":{"allow":["src","test"],"deny":["secrets"]},"verification":[{"command":["npm","test"],"timeoutSeconds":30}],"oracle":{"access":"evaluator-only","oracleRef":"evaluator-oracles/preserve-refactor.json"},"limits":{"timeoutSeconds":120,"maximumOutputBytes":65536},"expectedOutcome":"PASS","dataClassification":"public"}
