{"schemaVersion":"1.0","id":"money-zero","version":"v1","kind":"contract-api","risk":"low","languages":["python"],"difficulty":"easy","inclusionReason":"Adds a clear zero-value predicate for future auction settlement logic.","prompt":"Add an `is_zero` property to the Money value object that returns true only when cents equals zero. Keep the value object immutable.","initialState":{"repository":"src/eurocarscan/domain/money.py","revision":"7c84e5a"},"setup":[],"scope":{"allow":["src/eurocarscan/domain/money.py","tests"],"deny":[".env","secrets"]},"verification":[{"command":["python","-m","unittest","discover","-s","tests"],"timeoutSeconds":30}],"oracle":{"access":"evaluator-only","oracleRef":"oracles/money-zero.json"},"limits":{"timeoutSeconds":120,"maximumOutputBytes":65536},"expectedOutcome":"PASS","dataClassification":"private-redacted"}
