{"schemaVersion":"1.0","id":"api-not-found","version":"v1","kind":"contract-api","risk":"medium","languages":["csharp"],"difficulty":"medium","inclusionReason":"Makes API failures machine-readable before introducing auction mutations.","prompt":"Add a JSON 404 fallback to the ASP.NET Core API returning error not_found with HTTP status 404; do not add a bidding endpoint or call external services.","initialState":{"repository":"backend/EuroCarScan.Api/Program.cs","revision":"37f9210"},"setup":[],"scope":{"allow":["backend/EuroCarScan.Api/Program.cs","backend/EuroCarScan.Api.Tests/FoundationTests.cs"],"deny":[".env","secrets"]},"verification":[{"command":["dotnet","test","backend/EuroCarScan.Api.Tests/EuroCarScan.Api.Tests.csproj","--nologo"],"timeoutSeconds":120}],"oracle":{"access":"evaluator-only","oracleRef":"oracles/api-not-found.json"},"limits":{"timeoutSeconds":120,"maximumOutputBytes":65536},"expectedOutcome":"PASS","dataClassification":"private-redacted"}
