{"schemaVersion":"1.0","id":"api-not-found","version":"v1","kind":"contract-api","risk":"medium","languages":["python"],"difficulty":"medium","inclusionReason":"Makes API failures machine-readable before introducing auction mutations.","prompt":"Add a JSON 404 handler for the Flask app returning `{\"error\":\"not_found\"}` with HTTP status 404. Do not add a bidding endpoint or call external services.","initialState":{"repository":"src/eurocarscan/app.py","revision":"7c84e5a"},"setup":[],"scope":{"allow":["src/eurocarscan/app.py","tests"],"deny":[".env","secrets","src/eurocarscan/web/routes.py"]},"verification":[{"command":["python","-m","unittest","discover","-s","tests"],"timeoutSeconds":30}],"oracle":{"access":"evaluator-only","oracleRef":"oracles/api-not-found.json"},"limits":{"timeoutSeconds":120,"maximumOutputBytes":65536},"expectedOutcome":"PASS","dataClassification":"private-redacted"}
