{"schemaVersion":"1.0","id":"fix-boundary","version":"v1","kind":"bug-fix","risk":"medium","languages":["typescript"],"difficulty":"medium","inclusionReason":"Regression bug at an input boundary.","prompt":"Fix the inclusive upper-bound calculation and add a regression test.","initialState":{"repository":"fixtures/fix-boundary","revision":"0000000"},"setup":[],"scope":{"allow":["src","test"],"deny":["secrets"]},"verification":[{"command":["npm","test"],"timeoutSeconds":30}],"oracle":{"access":"evaluator-only","oracleRef":"evaluator-oracles/fix-boundary.json"},"limits":{"timeoutSeconds":120,"maximumOutputBytes":65536},"expectedOutcome":"PASS","dataClassification":"public"}
