{"schemaVersion":"1.0","id":"dag-order","version":"v1","kind":"dag-dependency","risk":"medium","languages":["javascript"],"difficulty":"medium","inclusionReason":"A dependency-order task tests coordinated updates across a small call graph.","prompt":"Make `tasks/dag-order/src/pipeline.js` call `normalize.js` before `sort.js`, and ensure the exported pipeline returns normalized sorted numbers. Keep both helper modules reusable.","initialState":{"repository":"repos/dag-order","revision":"0000000"},"setup":[],"scope":{"allow":["tasks/dag-order/src"],"deny":["secrets"]},"verification":[{"command":["node","tasks/dag-order/verify.mjs"],"timeoutSeconds":30}],"oracle":{"access":"evaluator-only","oracleRef":"oracles/dag-order.json"},"limits":{"timeoutSeconds":120,"maximumOutputBytes":65536},"expectedOutcome":"PASS","dataClassification":"public"}
